key,title,authors,year,journal,publisher,citations,url,tool
kong2012abrowse,ABrowse-a customizable next-generation genome browser framework,"Kong, Lei and Wang, Jun and Zhao, Shuqi and Gu, Xiaocheng and Luo, Jingchu and Gao, Ge",2012,BMC bioinformatics,BioMed Central,18,https://bmcbioinformatics.biomedcentral.com/articles/10.1186/1471-2105-13-2,ABrowse
lombardot2007metalook,MetaLook: a 3D visualisation software for marine ecological genomics,"Lombardot, Thierry and Kottmann, Renzo and Giuliani, Gregory and De Bono, Andr{\'e}a and Addor, Nans and Gl{\""o}ckner, Frank Oliver",2007,BMC bioinformatics,BioMed Central,10,https://bmcbioinformatics.biomedcentral.com/articles/10.1186/1471-2105-8-406,MetaLook
huntley2008genome,Genome Environment Browser (GEB): a dynamic browser for visualising high-throughput experimental data in the context of genome features,"Huntley, Derek and Tang, Y Amy and Nesterova, Tatyana B and Butcher, Sarah and Brockdorff, Neil",2008,BMC bioinformatics,BioMed Central,10,https://bmcbioinformatics.biomedcentral.com/articles/10.1186/1471-2105-9-501,GEB
sowpati2017c,C-State: an interactive web app for simultaneous multi-gene visualization and comparative epigenetic pattern search,"Sowpati, Divya Tej and Srivastava, Surabhi and Dhawan, Jyotsna and Mishra, Rakesh K",2017,BMC bioinformatics,BioMed Central,1,https://bmcbioinformatics.biomedcentral.com/articles/10.1186/s12859-017-1786-6,C-State
kijak2010recdraw,RecDraw: a software package for the representation of HIV-1 recombinant structures,"Kijak, Gustavo H and Tovanabutra, Sodsai and Beyrer, Chris and Sanders--Buell, Eric E and Arroyo, Miguel A and Robb, Merlin L and Michael, Nelson L and McCutchan, Francine E and Kim, Jerome H",2010,AIDS research and human retroviruses,"Mary Ann Liebert, Inc. 140 Huguenot Street, 3rd Floor New Rochelle, NY 10801 USA",5,https://www.liebertpub.com/doi/abs/10.1089/aid.2010.0127,RecDraw
yang2003genomecomp,GenomeComp: a visualization tool for microbial genome comparison,"Yang, Jian and Wang, Jinhua and Yao, Zhi-Jian and Jin, Qi and Shen, Yan and Chen, Runsheng",2003,Journal of microbiological methods,Elsevier,53,https://www.sciencedirect.com/science/article/pii/S0167701203000940,GenomeComp
hu2014gsds,GSDS 2.0: an upgraded gene feature visualization server,"Hu, Bo and Jin, Jinpu and Guo, An-Yuan and Zhang, He and Luo, Jingchu and Gao, Ge",2014,Bioinformatics,Oxford University Press,462,https://academic.oup.com/bioinformatics/article-abstract/31/8/1296/213025,GSDS
guo2007gsds,GSDS: a gene structure display server,"Guo, AY and Zhu, QH and Chen, Xin and Luo, JC",2007,Yi chuan= Hereditas,,541,https://europepmc.org/abstract/med/17681935,GSDS
liu2014diseaseconnect,DiseaseConnect: a comprehensive web server for mechanism-based disease--disease connections,"Liu, Chun-Chi and Tseng, Yu-Ting and Li, Wenyuan and Wu, Chia-Yu and Mayzus, Ilya and Rzhetsky, Andrey and Sun, Fengzhu and Waterman, Michael and Chen, Jeremy JW and Chaudhary, Preet M and others",2014,Nucleic acids research,Oxford University Press,57,https://academic.oup.com/nar/article-abstract/42/W1/W137/2437408,DiseaseConnect
pavesi2008exalign,Exalign: a new method for comparative analysis of exon--intron gene structures,"Pavesi, Giulio and Zambelli, Federico and Caggese, Corrado and Pesole, Graziano",2008,Nucleic acids research,Oxford University Press,20,https://academic.oup.com/nar/article-abstract/36/8/e47/2410452,Exalign
wang2012piece,PIECE: a database for plant gene structure comparison and evolution,"Wang, Yi and You, Frank M and Lazo, Gerard R and Luo, Ming-Cheng and Thilmony, Roger and Gordon, Sean and Kianian, Shahryar F and Gu, Yong Q",2012,Nucleic acids research,Oxford University Press,39,https://academic.oup.com/nar/article-abstract/41/D1/D1159/1059258,GSDraw
muhlhausen2014genepainter,GenePainter v. 2.0 resolves the taxonomic distribution of intron positions,"M{\""u}hlhausen, Stefanie and Hellkamp, Marcel and Kollmar, Martin",2014,Bioinformatics,Oxford University Press,6,https://academic.oup.com/bioinformatics/article-abstract/31/8/1302/212434,GenePainter
hammesfahr2013genepainter,"GenePainter: a fast tool for aligning gene structures of eukaryotic protein families, visualizing the alignments and mapping gene structures onto protein structures","Hammesfahr, Bj{\""o}rn and Odronitz, Florian and M{\""u}hlhausen, Stefanie and Waack, Stephan and Kollmar, Martin",2013,BMC bioinformatics,BioMed Central,15,https://bmcbioinformatics.biomedcentral.com/articles/10.1186/1471-2105-14-77,GenePainter
harrison2017gene,Gene Graphics: a genomic neighborhood data visualization web application,"Harrison, Katherine J and Cr{\'e}cy-Lagard, Val{\'e}rie de and Zallot, R{\'e}mi",2017,Bioinformatics,Oxford University Press,2,https://academic.oup.com/bioinformatics/article-abstract/34/8/1406/4708234,Gene Graphics
steinbiss2008annotationsketch,AnnotationSketch: a genome annotation drawing library,"Steinbiss, Sascha and Gremme, Gordon and Sch{\""a}rfer, Christin and Mader, Malte and Kurtz, Stefan",2008,Bioinformatics,Oxford University Press,28,https://academic.oup.com/bioinformatics/article-abstract/25/4/533/249853,AnnotationSketch
fawal2012geca,GECA: a fast tool for gene evolution and conservation analysis in eukaryotic protein families,"Fawal, Nizar and Savelli, Bruno and Dunand, Christophe and Math{\'e}, Catherine",2012,Bioinformatics,Oxford University Press,22,https://academic.oup.com/bioinformatics/article-abstract/28/10/1398/212898,GECA
frech2012featurestack,FeatureStack: Perl module for comparative visualization of gene features,"Frech, Christian and Choo, Caleb and Chen, Nansheng",2012,Bioinformatics,Oxford University Press,8,https://academic.oup.com/bioinformatics/article-abstract/28/23/3137/192826,FeatureStack
wilkinson2002genquire,Genquire: genome annotation browser/editor,"Wilkinson, Mark D. and Block, David and Crosby, William L",2002,Bioinformatics,Oxford University Press,13,https://academic.oup.com/bioinformatics/article-abstract/18/10/1398/250806,Genquire
snajder2013gpviz,GPViz: dynamic visualization of genomic regions and variants affecting protein domains,"Snajder, Rene and Trajanoski, Zlatko and Hackl, Hubert",2013,Bioinformatics,Oxford University Press,5,https://academic.oup.com/bioinformatics/article-abstract/29/17/2195/240918,GPViz
mall2016protannot,ProtAnnot: an App for Integrated Genome Browser to display how alternative splicing and transcription affect proteins,"Mall, Tarun and Eckstein, John and Norris, David and Vora, Hiral and Freese, Nowlan H and Loraine, Ann E",2016,Bioinformatics,Oxford University Press,3,https://academic.oup.com/bioinformatics/article-abstract/32/16/2499/1742889,ProtAnnot
khan2017intervene,Intervene: a tool for intersection and visualization of multiple gene or genomic region sets,"Khan, Aziz and Mathelier, Anthony",2017,BMC bioinformatics,BioMed Central,11,https://bmcbioinformatics.biomedcentral.com/articles/10.1186/s12859-017-1708-7,Intervene
stinear2008insights,Insights from the complete genome sequence of Mycobacterium marinum on the evolution of Mycobacterium tuberculosis,"Stinear, Timothy P and Seemann, Torsten and Harrison, Paul F and Jenkin, Grant A and Davies, John K and Johnson, Paul DR and Abdellah, Zahra and Arrowsmith, Claire and Chillingworth, Tracey and Churcher, Carol and others",2008,Genome research,Cold Spring Harbor Lab,409,http://genome.cshlp.org/content/early/2008/04/10/gr.075069.107.short,Gene Spaghetti
rambaldi2009fancygene,FancyGene: dynamic visualization of gene structures and protein domain architectures on genomic loci,"Rambaldi, Davide and Ciccarelli, Francesca D",2009,Bioinformatics,Oxford University Press,114,https://academic.oup.com/bioinformatics/article-abstract/25/17/2281/210792,FancyGene
vivek2003xdomview,XdomView: protein domain and exon position visualization,"Vivek, Gopalan and Tan, Tin Wee and Ranganathan, Shoba",2003,Bioinformatics,Oxford University Press,17,https://academic.oup.com/bioinformatics/article-abstract/19/1/159/316878,XdomView
beisvag2006genetools,GeneTools--application for functional annotation and statistical hypothesis testing,"Beisvag, Vidar and J{\""u}nge, Frode KR and Bergum, Hallgeir and J{\o}lsum, Lars and Lydersen, Stian and G{\""u}nther, Clara-Cecilie and Ramampiaro, Heri and Langaas, Mette and Sandvik, Arne K and L{\ae}greid, Astrid",2006,BMC bioinformatics,BioMed Central,106,https://bmcbioinformatics.biomedcentral.com/articles/10.1186/1471-2105-7-470,eGOn
alikhan2011blast,BLAST Ring Image Generator (BRIG): simple prokaryote genome comparisons,"Alikhan, Nabil-Fareed and Petty, Nicola K and Zakour, Nouri L Ben and Beatson, Scott A",2011,BMC genomics,BioMed Central,782,https://bmcgenomics.biomedcentral.com/track/pdf/10.1186/1471-2164-12-402?hostname=http://bmcgenomics.biomedcentral.com,BRIG
stothard2017visualizing,Visualizing and comparing circular genomes using the CGView family of tools,"Stothard, Paul and Grant, Jason R and Van Domselaar, Gary",2017,Briefings in bioinformatics,,4,https://academic.oup.com/bib/advance-article/doi/10.1093/bib/bbx081/4037458,CGView
grant2012comparing,Comparing thousands of circular genomes using the CGView Comparison Tool,"Grant, Jason R and Arantes, Adriano S and Stothard, Paul",2012,BMC genomics,BioMed Central,117,https://bmcgenomics.biomedcentral.com/articles/10.1186/1471-2164-13-202,CGView
grant2008cgview,The CGView Server: a comparative genomics tool for circular genomes,"Grant, Jason R and Stothard, Paul",2008,Nucleic acids research,Oxford University Press,279,https://academic.oup.com/nar/article-abstract/36/suppl_2/W181/2505750,CGView
lohse2013organellargenomedraw,OrganellarGenomeDRAW—a suite of tools for generating physical maps of plastid and mitochondrial genomes and visualizing expression data sets,"Lohse, Marc and Drechsel, Oliver and Kahlau, Sabine and Bock, Ralph",2013,Nucleic acids research,Oxford University Press,451,https://academic.oup.com/nar/article-abstract/41/W1/W575/1092342,OGDRAW
carver2008dnaplotter,DNAPlotter: circular and linear interactive genome visualization,"Carver, Tim and Thomson, Nick and Bleasby, Alan and Berriman, Matthew and Parkhill, Julian",2008,Bioinformatics,Oxford University Press,458,https://academic.oup.com/bioinformatics/article-abstract/25/1/119/302954,DNAPlotter
conant2008genomevx,GenomeVx: simple web-based creation of editable circular chromosome maps,"Conant, Gavin C and Wolfe, Kenneth H",2008,Bioinformatics,Oxford University Press,192,https://academic.oup.com/bioinformatics/article-abstract/24/6/861/192498,GenomeVx
laird2015genomed3plot,"GenomeD3Plot: a library for rich, interactive visualizations of genomic data in web applications","Laird, Matthew R and Langille, Morgan GI and Brinkman, Fiona SL",2015,Bioinformatics,Oxford University Press,14,https://academic.oup.com/bioinformatics/article-abstract/31/20/3348/196001,GenomeD3Plot
overmars2015civi,CiVi: circular genome visualization with unique features to analyze sequence elements,"Overmars, Lex and van Hijum, Sacha AFT and Siezen, Roland J and Francke, Christof",2015,Bioinformatics,Oxford University Press,14,https://academic.oup.com/bioinformatics/article-abstract/31/17/2867/183091,CiVi
meyer2009mizbee,MizBee: a multiscale synteny browser,"Meyer, Miriah and Munzner, Tamara and Pfister, Hanspeter",2009,IEEE Transactions on Visualization \& Computer Graphics,IEEE,130,https://www.computer.org/csdl/trans/tg/2009/06/ttg2009060897-abs.html,MizBee
hallin2009genewiz,GeneWiz browser: an interactive tool for visualizing sequenced chromosomes,"Hallin, Peter F and St{\ae}rfeldt, Hans-Henrik and Rotenberg, Eva and Binnewies, Tim T and Benham, Craig J and Ussery, David W",2009,Standards in genomic sciences,BioMed Central,18,https://standardsingenomics.biomedcentral.com/articles/10.4056/sigs.28177,GeneWiz
lacroix2015synchronized,Synchronized navigation and comparative analyses across Ensembl complete bacterial genomes with INSYGHT,"Lacroix, Thomas and Th{\'e}rond, Sylvie and Rugeri, Marc and Nicolas, Pierre and Gendrault, Annie and Loux, Valentin and Gibrat, Jean-Fran{\c{c}}ois",2015,Bioinformatics,Oxford University Press,1,https://academic.oup.com/bioinformatics/article-abstract/32/7/1083/1743891,INSYGHT
lacroix2014insyght,"Insyght: navigating amongst abundant homologues, syntenies and gene functional annotations in bacteria, it's that symbol!","Lacroix, Thomas and Loux, Valentin and Gendrault, Annie and Hoebeke, Mark and Gibrat, Jean-Fran{\c{c}}ois",2014,Nucleic acids research,Oxford University Press,6,https://academic.oup.com/nar/article-abstract/42/21/e162/2903165,INSYGHT
riley2011using,Using Sybil for interactive comparative genomics of microbes on the web,"Riley, David R and Angiuoli, Samuel V and Crabtree, Jonathan and Dunning Hotopp, Julie C and Tettelin, Herv{\'e}",2011,Bioinformatics,Oxford University Press,38,https://academic.oup.com/bioinformatics/article-abstract/28/2/160/199610,Sybil
crabtree2007sybil,Sybil: methods and software for multiple genome comparison and visualization,"Crabtree, Jonathan and Angiuoli, Samuel V and Wortman, Jennifer R and White, Owen R",2007,,Springer,67,https://link.springer.com/protocol/10.1007/978-1-59745-547-3_6,Sybil
ovcharenko2004ecr,ECR Browser: a tool for visualizing and accessing data from comparisons of multiple vertebrate genomes,"Ovcharenko, Ivan and Nobrega, Marcelo A and Loots, Gabriela G and Stubbs, Lisa",2004,Nucleic acids research,Oxford University Press,441,https://academic.oup.com/nar/article-abstract/32/suppl_2/W280/1040442,ECR Browser
veltri2016simplesynteny,SimpleSynteny: a web-based tool for visualization of microsynteny across multiple species,"Veltri, Daniel and Wight, Martha Malapi and Crouch, Jo Anne",2016,Nucleic acids research,Oxford University Press,13,https://academic.oup.com/nar/article-abstract/44/W1/W41/2499332,SimpleSynteny
lee2016synteny,Synteny Portal: a web-based application portal for synteny block analysis,"Lee, Jongin and Hong, Woon-young and Cho, Minah and Sim, Mikang and Lee, Daehwan and Ko, Younhee and Kim, Jaebum",2016,Nucleic acids research,Oxford University Press,7,https://academic.oup.com/nar/article-abstract/44/W1/W35/2499326,Synteny Portal
murat2013shared,Shared subgenome dominance following polyploidization explains grass genome evolutionary plasticity from a seven protochromosome ancestor with 16K protogenes,"Murat, Florent and Zhang, Rongzhi and Guizard, Sebastien and Flores, Raphael and Armero, Alix and Pont, Caroline and Steinbach, Delphine and Quesneville, Hadi and Cooke, Richard and Salse, Jerome",2013,Genome biology and evolution,Oxford University Press,45,https://academic.oup.com/gbe/article-abstract/6/1/12/664310,Plant Synteny Viewer
pont2013wheat,Wheat syntenome unveils new evidences of contrasted evolutionary plasticity between paleo-and neoduplicated subgenomes,"Pont, Caroline and Murat, Florent and Guizard, S{\'e}bastien and Flores, Raphael and Foucrier, S{\'e}verine and Bidet, Yannick and Quraishi, Umar Masood and Alaux, Michael and Dole{\v{z}}el, Jaroslav and Fahima, Tzion and others",2013,The Plant Journal,Wiley Online Library,51,https://onlinelibrary.wiley.com/doi/abs/10.1111/tpj.12366,Plant Synteny Viewer
haug2017synmap2,SynMap2 and SynMap3D: web-based whole-genome synteny browsers,"Haug-Baltzell, Asher and Stephens, Sean A and Davey, Sean and Scheidegger, Carlos E and Lyons, Eric",2017,Bioinformatics,Oxford University Press,3,https://academic.oup.com/bioinformatics/article-abstract/33/14/2197/3072872,SynMap3D
lemoine2008syntebase,SynteBase/SynteView: a tool to visualize gene order conservation in prokaryotic genomes,"Lemoine, Fr{\'e}d{\'e}ric and Labedan, Bernard and Lespinet, Olivier",2008,BMC bioinformatics,BioMed Central,13,https://bmcbioinformatics.biomedcentral.com/articles/10.1186/1471-2105-9-536,SynteView
paterson2013arkmap,ArkMAP: integrating genomic maps across species and data sources,"Paterson, Trevor and Law, Andy",2013,BMC bioinformatics,BioMed Central,6,https://bmcbioinformatics.biomedcentral.com/articles/10.1186/1471-2105-14-246,ArkMAP
farrer2017synima,Synima: a Synteny imaging tool for annotated genome assemblies,"Farrer, Rhys A",2017,BMC bioinformatics,BioMed Central,0,https://bmcbioinformatics.biomedcentral.com/articles/10.1186/s12859-017-1939-7,Synima
mckay2010using,Using the generic synteny browser (GBrowse\_syn),"McKay, Sheldon J and Vergara, Ismael A and Stajich, Jason E",2010,Current protocols in bioinformatics,Wiley Online Library,51,https://currentprotocols.onlinelibrary.wiley.com/doi/abs/10.1002/0471250953.bi0912s31,GBrowse_syn
baek2016multisyn,MultiSyn: A Webtool for Multiple Synteny Detection and Visualization of User's Sequence of Interest Compared to Public Plant Species,"Baek, Jeong-Ho and Kim, Junah and Kim, Chang-Kug and Sohn, Seong-Han and Choi, Dongsu and Ratnaparkhe, Milind B and Kim, Do-Wan and Lee, Tae-Ho",2016,Evolutionary Bioinformatics,"SAGE Publications Sage UK: London, England",1,http://journals.sagepub.com/doi/abs/10.4137/EBO.S40009,MultiSyn
thanki2018aequatus,Aequatus: An open-source homology browser,"Thanki, Anil S and Soranzo, Nicola and Herrero, Javier and Haerty, Wilfried and Davey, Robert P",2018,bioRxiv,Cold Spring Harbor Laboratory,2,https://www.biorxiv.org/content/early/2018/06/15/055632.abstract,Aequatus
wang2006synview,SynView: a GBrowse-compatible approach to visualizing comparative genome data,"Wang, Haiming and Su, Yanqi and Mackey, Aaron J and Kraemer, Eileen T and Kissinger, Jessica C",2006,Bioinformatics,Oxford University Press,40,https://academic.oup.com/bioinformatics/article-abstract/22/18/2308/318102,SynView
pan2005synbrowse,SynBrowse: a synteny browser for comparative sequence analysis,"Pan, Xiaokang and Stein, Lincoln and Brendel, Volker",2005,Bioinformatics,Oxford University Press,81,https://academic.oup.com/bioinformatics/article-abstract/21/17/3461/212490,SynBrowse
revanna2011gsv,GSV: a web-based genome synteny viewer for customized data,"Revanna, Kashi V and Chiu, Chi-Chen and Bierschank, Ezekiel and Dong, Qunfeng",2011,BMC bioinformatics,BioMed Central,28,https://bmcbioinformatics.biomedcentral.com/articles/10.1186/1471-2105-12-316,GSV
revanna2012web,A web-based multi-genome synteny viewer for customized data,"Revanna, Kashi V and Munro, Daniel and Gao, Alvin and Chiu, Chi-Chen and Pathak, Anil and Dong, Qunfeng",2012,BMC bioinformatics,BioMed Central,17,https://bmcbioinformatics.biomedcentral.com/articles/10.1186/1471-2105-13-190,mGSV
kearse2012geneious,Geneious Basic: an integrated and extendable desktop software platform for the organization and analysis of sequence data,"Kearse, Matthew and Moir, Richard and Wilson, Amy and Stones-Havas, Steven and Cheung, Matthew and Sturrock, Shane and Buxton, Simon and Cooper, Alex and Markowitz, Sidney and Duran, Chris and others",2012,Bioinformatics,Oxford University Press,5370,https://academic.oup.com/bioinformatics/article-abstract/28/12/1647/267326,Geneious
brudno2007multiple,Multiple whole genome alignments and novel biomedical applications at the VISTA portal,"Brudno, Michael and Poliakov, Alexander and Minovitsky, Simon and Ratnere, Igor and Dubchak, Inna",2007,Nucleic acids research,Oxford University Press,33,https://academic.oup.com/nar/article-abstract/35/suppl_2/W669/2920810,Phylo-VISTA
frazer2004vista,VISTA: computational tools for comparative genomics,"Frazer, Kelly A and Pachter, Lior and Poliakov, Alexander and Rubin, Edward M and Dubchak, Inna",2004,Nucleic acids research,Oxford University Press,1169,https://academic.oup.com/nar/article-abstract/32/suppl_2/W273/1040703,Phylo-VISTA
shah2004phylo,Phylo-VISTA: interactive visualization of multiple DNA sequence alignments,"Shah, Nameeta and Couronne, Olivier and Pennacchio, Len A and Brudno, Michael and Batzoglou, Serafim and Bethel, E Wes and Rubin, Edward M and Hamann, Bernd and Dubchak, Inna",2004,Bioinformatics,Oxford University Press,57,https://academic.oup.com/bioinformatics/article-abstract/20/5/636/213563,Phylo-VISTA
mayor2000vista,VISTA: visualizing global DNA sequence alignments of arbitrary length,"Mayor, Chris and Brudno, Michael and Schwartz, Jody R and Poliakov, Alexander and Rubin, Edward M and Frazer, Kelly A and Pachter, Lior S and Dubchak, Inna",2000,Bioinformatics,Oxford University Press,839,https://academic.oup.com/bioinformatics/article-abstract/16/11/1046/216527,Phylo-VISTA
larsson2014aliview,AliView: a fast and lightweight alignment viewer and editor for large datasets,"Larsson, Anders",2014,Bioinformatics,Oxford University Press,388,https://academic.oup.com/bioinformatics/article-abstract/30/22/3276/2391211,AliView
waterhouse2009jalview,Jalview Version 2—a multiple sequence alignment editor and analysis workbench,"Waterhouse, Andrew M and Procter, James B and Martin, David MA and Clamp, Mich{\`e}le and Barton, Geoffrey J",2009,Bioinformatics,Oxford University Press,3950,https://academic.oup.com/bioinformatics/article-abstract/25/9/1189/203460,Jalview
clamp2004jalview,The jalview java alignment editor,"Clamp, Michele and Cuff, James and Searle, Stephen M and Barton, Geoffrey J",2004,Bioinformatics,Oxford University Press,1517,https://academic.oup.com/bioinformatics/article-abstract/20/3/426/186358,Jalview
gouy2009seaview,SeaView version 4: a multiplatform graphical user interface for sequence alignment and phylogenetic tree building,"Gouy, Manolo and Guindon, St{\'e}phane and Gascuel, Olivier",2009,Molecular biology and evolution,Oxford University Press,3127,https://academic.oup.com/mbe/article-abstract/27/2/221/970247,SeaView
galtier1996seaview,SEAVIEW and PHYLO\_WIN: two graphic tools for sequence alignment and molecular phylogeny,"Galtier, Nicolas and Gouy, Manolo and Gautier, Christian",1996,Bioinformatics,Oxford University Press,2279,https://academic.oup.com/bioinformatics/article-abstract/12/6/543/231577,SeaView
florea2003enterix,EnteriX 2003: Visualization tools for genome alignments of Enterobacteriaceae,"Florea, Liliana and McClelland, Michael and Riemer, Cathy and Schwartz, Scott and Miller, Webb",2003,Nucleic acids research,Oxford University Press,29,https://academic.oup.com/nar/article-abstract/31/13/3527/2904173,EnteriX
florea2000web,Web-based visualization tools for bacterial genome alignments,"Florea, Liliana and Riemer, Cathy and Schwartz, Scott and Zhang, Zheng and Stojanovic, Nikola and Miller, Webb and McClelland, Michael",2000,Nucleic acids research,Oxford University Press,45,https://academic.oup.com/nar/article-abstract/28/18/3486/2912397,EnteriX
collins2018pasta,PASTA for Proteins,"Collins, Kodi and Warnow, Tandy and Schwartz, Russell",2018,Bioinformatics,,0,https://academic.oup.com/bioinformatics/advance-article-abstract/doi/10.1093/bioinformatics/bty495/5040315,PASTA
mirarab2015pasta,PASTA: ultra-large multiple sequence alignment for nucleotide and amino-acid sequences,"Mirarab, Siavash and Nguyen, Nam and Guo, Sheng and Wang, Li-San and Kim, Junhyong and Warnow, Tandy",2015,Journal of Computational Biology,"Mary Ann Liebert, Inc. 140 Huguenot Street, 3rd Floor New Rochelle, NY 10801 USA",70,https://www.liebertpub.com/doi/abs/10.1089/cmb.2014.0156,PASTA
mirarab2014pasta,PASTA: ultra-large multiple sequence alignment,"Mirarab, Siavash and Nguyen, Nam and Warnow, Tandy",2014,,,34,https://link.springer.com/chapter/10.1007/978-3-319-05269-4_15,PASTA
treangen2014harvest,The Harvest suite for rapid core-genome alignment and visualization of thousands of intraspecific microbial genomes,"Treangen, Todd J and Ondov, Brian D and Koren, Sergey and Phillippy, Adam M",2014,Genome biology,BioMed Central,278,https://genomebiology.biomedcentral.com/articles/10.1186/s13059-014-0524-x,Gingr
joachimiak2002jevtrace,JEvTrace: refinement and variations of the evolutionary trace in JAVA,"Joachimiak, Marcin P and Cohen, Fred E",2002,Genome biology,BioMed Central,25,https://genomebiology.biomedcentral.com/articles/10.1186/gb-2002-3-12-research0077,JEvTrace
wilm2008construct,ConStruct: improved construction of RNA consensus structures,"Wilm, Andreas and Linnenbrink, Kornelia and Steger, Gerhard",2008,BMC bioinformatics,BioMed Central,43,https://bmcbioinformatics.biomedcentral.com/articles/10.1186/1471-2105-9-219,ConStruct
rupert1999construct,Construct a tool for thermodynamic controlled prediction of conserved secondary structure,"Rupert, Luck and Stefan, Graf",1999,Nucleic acids research,Oxford University Press,107,https://academic.oup.com/nar/article-abstract/27/21/4208/2384274,ConStruct
gille2014alignment,Alignment-Annotator web server: rendering and annotating sequence alignments,"Gille, Christoph and F{\""a}hling, Michael and Weyand, Birgit and Wieland, Thomas and Gille, Andreas",2014,Nucleic acids research,Oxford University Press,30,https://academic.oup.com/nar/article-abstract/42/W1/W3/2437256,Alignment-Annotator
gille2006hotswap,HotSwap for bioinformatics: a STRAP tutorial,"Gille, Christoph and Robinson, Peter N",2006,BMC bioinformatics,BioMed Central,11,https://bmcbioinformatics.biomedcentral.com/articles/10.1186/1471-2105-7-64,STRAP
gille2001strap,STRAP: editor for STRuctural Alignments of Proteins,"Gille, Christoph and Fr{\""o}mmel, Cornelius",2001,Bioinformatics,Oxford University Press,224,https://academic.oup.com/bioinformatics/article-abstract/17/4/377/328261,STRAP
caffrey2007pfaat,"PFAAT version 2.0: a tool for editing, annotating, and analyzing multiple sequence alignments","Caffrey, Daniel R and Dana, Paul H and Mathur, Vidhya and Ocano, Marco and Hong, Eun-Jong and Wang, Yaoyu E and Somaroo, Shyamal and Caffrey, Brian E and Potluri, Shobha and Huang, Enoch S",2007,BMC bioinformatics,BioMed Central,57,https://bmcbioinformatics.biomedcentral.com/articles/10.1186/1471-2105-8-381,PFAAT
johnson2003protein,Protein family annotation in a multiple alignment viewer,"Johnson, Jason M and Mason, Keith and Moallemi, Ciamac and Xi, Hualin and Somaroo, Shyamal and Huang, Enoch S",2003,Bioinformatics,Oxford University Press,46,https://academic.oup.com/bioinformatics/article-abstract/19/4/544/218760,PFAAT
