key,title,authors,year,journal,publisher,citations,url,tool
salavert2016web,Web-based network analysis and visualization using CellMaps,"Salavert, Francisco and Garc{\'\i}a-Alonso, Luz and S{\'a}nchez, Rub{\'e}n and Alonso, Roberto and Bleda, Marta and Medina, Ignacio and Dopazo, Joaqu{\'\i}n",2016,Bioinformatics,Oxford University Press,5,https://academic.oup.com/bioinformatics/article-abstract/32/19/3041/2196388,CellMaps
taylor2014genenet,GeneNet Toolbox for MATLAB: a flexible platform for the analysis of gene connectivity in biological networks,"Taylor, Avigail and Steinberg, Julia and Andrews, Tallulah S and Webber, Caleb",2014,Bioinformatics,Oxford University Press,7,https://academic.oup.com/bioinformatics/article-abstract/31/3/442/2366250,GeneNet
salwinski2007misink,The MiSink Plugin: Cytoscape as a graphical interface to the Database of Interacting Proteins,"Salwinski, Lukasz and Eisenberg, David",2007,Bioinformatics,Oxford University Press,16,https://academic.oup.com/bioinformatics/article-abstract/23/16/2193/198476,MiSink
bahceci2017pathwaymapper,PathwayMapper: a collaborative visual web editor for cancer pathways and genomic data,"Bahceci, Istemi and Dogrusoz, Ugur and La, Konnor C and Babur, {\""O}zg{\""u}n and Gao, Jianjiong and Schultz, Nikolaus",2017,Bioinformatics,Oxford University Press,6,https://academic.oup.com/bioinformatics/article-abstract/33/14/2238/3072875,PathwayMapper
kochanczyk2017spatkin,SPATKIN: a simulator for rule-based modeling of biomolecular site dynamics on surfaces,"Kocha{\'n}czyk, Marek and Hlavacek, William S and Lipniacki, Tomasz",2017,Bioinformatics,Oxford University Press,3,https://academic.oup.com/bioinformatics/article-abstract/33/22/3667/3977846,SPATKIN
kanai2018grimon,Grimon: Graphical interface to visualize multi-omics networks,"Kanai, Masahiro and Maeda, Yuichi and Okada, Yukinori and Hancock, John",2018,Bioinformatics,,0,https://academic.oup.com/bioinformatics/advance-article-abstract/doi/10.1093/bioinformatics/bty488/5040322,Grimon
chua2017trove,TROVE: a user-friendly tool for visualizing and analyzing cancer hallmarks in signaling networks,"Chua, Huey Eng and Bhowmick, Sourav S and Zheng, Jie",2017,Bioinformatics,Oxford University Press,0,https://academic.oup.com/bioinformatics/article-abstract/34/2/314/4209992,TROVE
li2017dynetviewer,"DyNetViewer: a Cytoscape app for dynamic network construction, analysis and visualization","Li, Min and Yang, Jie and Wu, Fang-Xiang and Pan, Yi and Wang, Jianxin",2017,Bioinformatics,Oxford University Press,6,https://academic.oup.com/bioinformatics/article-abstract/34/9/1597/4774298,DyNetViewer
salviato2016simpathy,simPATHy: a new method for simulating data from perturbed biological PATHways,"Salviato, Elisa and Djordjilovi{\'c}, Vera and Chiogna, Monica and Romualdi, Chiara",2016,Bioinformatics,Oxford University Press,1,https://academic.oup.com/bioinformatics/article-abstract/33/3/456/2585047,simPATHy
schwab2016visibool,ViSiBooL—visualization and simulation of Boolean networks with temporal constraints,"Schwab, Julian and Burkovski, Andre and Siegle, Lea and M{\""u}ssel, Christoph and Kestler, Hans A",2016,Bioinformatics,Oxford University Press,7,https://academic.oup.com/bioinformatics/article-abstract/33/4/601/2593908,ViSiBooL
ghosh2018slide,SLIDE--a web-based tool for interactive visualization of large-scale--omics data,"Ghosh, Soumita and Datta, Abhik and Tan, Kaisen and Choi, Hyungwon and Stegle, Oliver",2018,Bioinformatics,,0,https://academic.oup.com/bioinformatics/advance-article-abstract/doi/10.1093/bioinformatics/bty534/5046258,SLIDE
schafer2016visualgraphx,VisualGraphX: interactive graph visualization within Galaxy,"Sch{\""a}fer, Richard A and Vo{\ss}, Bj{\""o}rn",2016,Bioinformatics,Oxford University Press,1,https://academic.oup.com/bioinformatics/article-abstract/32/22/3525/2525593,VISUALGRAPHX
cromar2015hyperscape,Hyperscape: visualization for complex biological networks,"Cromar, Graham L and Zhao, Anthony and Yang, Alex and Parkinson, John",2015,Bioinformatics,Oxford University Press,4,https://academic.oup.com/bioinformatics/article-abstract/31/20/3390/196136,Hyperscape
psomopoulos2017biopaxviz,BioPAXViz: a cytoscape application for the visual exploration of metabolic pathway evolution,"Psomopoulos, Fotis E and Vitsios, Dimitrios M and Baichoo, Shakuntala and Ouzounis, Christos A",2017,Bioinformatics,Oxford University Press,3,https://academic.oup.com/bioinformatics/article/2902713,BioPAXViz
rosenthal2017interactive,Interactive network visualization in Jupyter notebooks: visJS2jupyter,"Rosenthal, Sara Brin and Len, Julia and Webster, Mikayla and Gary, Aaron and Birmingham, Amanda and Fisch, Kathleen M",2017,Bioinformatics,Oxford University Press,2,https://academic.oup.com/bioinformatics/article-abstract/34/1/126/4158037,visJS2jupyter
soto2017litpathexplorer,LitPathExplorer: a confidence-based visual text analytics tool for exploring literature-enriched pathway models,"Soto, Axel J and Zerva, Chrysoula and Batista-Navarro, Riza and Ananiadou, Sophia",2017,Bioinformatics,Oxford University Press,1,https://academic.oup.com/bioinformatics/article-abstract/34/8/1389/4708301,LitPathExplorer
calderone2018spv,SPV: a JavaScript Signaling Pathway Visualizer,"Calderone, Alberto and Cesareni, Gianni",2018,Bioinformatics,Oxford University Press,0,https://academic.oup.com/bioinformatics/advance-article-pdf/doi/10.1093/bioinformatics/bty188/24543827/bty188.pdf,SPV
katari2010virtualplant,VirtualPlant: a software platform to support systems biology research,"Katari, Manpreet S and Nowicki, Steve D and Aceituno, Felipe F and Nero, Damion and Kelfer, Jonathan and Thompson, Lee Parnell and Cabello, Juan M and Davidson, Rebecca S and Goldberg, Arthur P and Shasha, Dennis E and others",2010,Plant physiology,Am Soc Plant Biol,194,http://www.plantphysiol.org/content/152/2/500.short,VirtualPlant
nepomnyachiy2015cytostruct,CyToStruct: augmenting the network visualization of cytoscape with the power of molecular viewers,"Nepomnyachiy, Sergey and Ben-Tal, Nir and Kolodny, Rachel",2015,Structure,Elsevier,9,https://www.sciencedirect.com/science/article/pii/S0969212615000763,CyToStruct
doutreligne2015unitymol,UnityMol: interactive and ludic visual manipulation of coarse-grained RNA and other biomolecules,"Doutreligne, Sebastien and Gageat, Cedric and Cragnolini, Tristan and Taly, Antoine and Pasquali, Samuela and Derreumaux, Philippe and Baaden, Marc",2015,,,2,https://ieeexplore.ieee.org/abstract/document/7151718/,UnityMol
doutreligne2014unitymol,UnityMol: Interactive scientific visualization for integrative biology,"Doutreligne, S{\'e}bastien and Cragnolini, Tristan and Pasquali, Samuela and Derreumaux, Philippe and Baaden, Marc",2014,,,8,https://ieeexplore.ieee.org/abstract/document/7013213/,UnityMol
king2015escher,"Escher: a web application for building, sharing, and embedding data-rich visualizations of biological pathways","King, Zachary A and Dr{\""a}ger, Andreas and Ebrahim, Ali and Sonnenschein, Nikolaus and Lewis, Nathan E and Palsson, Bernhard O",2015,PLoS computational biology,Public Library of Science,72,http://journals.plos.org/ploscompbiol/article?id=10.1371/journal.pcbi.1004321,Escher
moghadam2017piil,PiiL: visualization of DNA methylation and gene expression data in gene pathways,"Moghadam, Behrooz Torabi and Zamani, Neda and Komorowski, Jan and Grabherr, Manfred",2017,BMC genomics,BioMed Central,0,https://bmcgenomics.biomedcentral.com/articles/10.1186/s12864-017-3950-9,PiiL
kaever2015marvis,MarVis-Pathway: integrative and exploratory pathway analysis of non-targeted metabolomics data,"Kaever, Alexander and Landesfeind, Manuel and Feussner, Kirstin and Mosblech, Alina and Heilmann, Ingo and Morgenstern, Burkhard and Feussner, Ivo and Meinicke, Peter",2015,Metabolomics,Springer,41,https://link.springer.com/article/10.1007/s11306-014-0734-y,MarVis-Pathway
heberle2017cellnetvis,CellNetVis: a web tool for visualization of biological networks using force-directed layout constrained by cellular components,"Heberle, Henry and Carazzolle, Marcelo Falsarella and Telles, Guilherme P and Meirelles, Gabriela Vaz and Minghim, Rosane",2017,BMC bioinformatics,BioMed Central,4,https://bmcbioinformatics.biomedcentral.com/articles/10.1186/s12859-017-1787-5,CellNetVis
li2017cytocluster,CytoCluster: A Cytoscape Plugin for Cluster Analysis and Visualization of Biological Networks,"Li, Min and Li, Dongyan and Tang, Yu and Wu, Fangxiang and Wang, Jianxin",2017,International journal of molecular sciences,Multidisciplinary Digital Publishing Institute,2,https://www.mdpi.com/1422-0067/18/9/1880/htm,CytoCluster
kono2009pathway,Pathway projector: web-based zoomable pathway browser using KEGG atlas and Google Maps API,"Kono, Nobuaki and Arakawa, Kazuharu and Ogawa, Ryu and Kido, Nobuhiro and Oshita, Kazuki and Ikegami, Keita and Tamaki, Satoshi and Tomita, Masaru",2009,PloS one,Public Library of Science,93,http://journals.plos.org/plosone/article?id=10.1371/journal.pone.0007710,Pathway Projector
handen2015lens,LENS: web-based lens for enrichment and network studies of human proteins,"Handen, Adam and Ganapathiraju, Madhavi K",2015,BMC medical genomics,BioMed Central,16,https://bmcmedgenomics.biomedcentral.com/articles/10.1186/1755-8794-8-S4-S2,LENS
mustafin2017orthoscape,Orthoscape: a cytoscape application for grouping and visualization KEGG based gene networks by taxonomy and homology principles,"Mustafin, Zakhar Sergeevich and Lashin, Sergey Alexandrovich and Matushkin, Yury Georgievich and Gunbin, Konstantin Vladimirovich and Afonnikov, Dmitry Arkadievich",2017,BMC bioinformatics,BioMed Central,4,https://bmcbioinformatics.biomedcentral.com/articles/10.1186/s12859-016-1427-5,Orthoscape
gratzl2014domino,"Domino: Extracting, comparing, and manipulating subsets across multiple tabular datasets","Gratzl, Samuel and Gehlenborg, Nils and Lex, Alexander and Pfister, Hanspeter and Streit, Marc",2014,IEEE Transactions on Visualization \& Computer Graphics,IEEE,33,https://ieeexplore.ieee.org/iel7/2945/4359476/06875920.pdf,Domino
abby2014macsyfinder,MacSyFinder: a program to mine genomes for molecular systems with an application to CRISPR-Cas systems,"Abby, Sophie S and N{\'e}ron, Bertrand and M{\'e}nager, Herv{\'e} and Touchon, Marie and Rocha, Eduardo PC",2014,PloS one,Public Library of Science,30,http://journals.plos.org/plosone/article?id=10.1371/journal.pone.0110726,MacSyView
niederer2018taco,Taco: Visualizing changes in tables over time,"Niederer, Christina and Stitz, Holger and Hourieh, Reem and Grassinger, Florian and Aigner, Wolfgang and Streit, Marc",2018,IEEE Transactions on Visualization \& Computer Graphics,IEEE,4,https://ieeexplore.ieee.org/iel7/2945/4359476/08017626.pdf,TACO
new2008dynamic,Dynamic visualization of coexpression in systems genetics data,"New, Joshua and Kendall, Wesley and Huang, Jian and Chesler, Elissa",2008,IEEE transactions on visualization and computer graphics,IEEE,7,https://ieeexplore.ieee.org/abstract/document/4492772/,SeeGraph
gerasch2014bina,BiNA: a visual analytics tool for biological network data,"Gerasch, Andreas and Faber, Daniel and K{\""u}ntzer, Jan and Niermann, Peter and Kohlbacher, Oliver and Lenhof, Hans-Peter and Kaufmann, Michael",2014,PloS one,Public Library of Science,26,http://journals.plos.org/plosone/article?id=10.1371/journal.pone.0087397,BiNA
secrier2013phenotimer,PhenoTimer: software for the visual mapping of time-resolved phenotypic landscapes,"Secrier, Maria and Schneider, Reinhard",2013,PloS one,Public Library of Science,2,http://journals.plos.org/plosone/article?id=10.1371/journal.pone.0072361,PhenoTimer
sari2015sbgnviz,SBGNViz: a tool for visualization and complexity management of SBGN process description maps,"Sari, Mecit and Bahceci, Istemi and Dogrusoz, Ugur and Sumer, Selcuk Onur and Aksoy, B{\""u}lent Arman and Babur, {\""O}zg{\""u}n and Demir, Emek",2015,PloS one,Public Library of Science,14,http://journals.plos.org/plosone/article?id=10.1371/journal.pone.0128985,SBGNViz
morris2011clustermaker,clusterMaker: a multi-algorithm clustering plugin for Cytoscape,"Morris, John H and Apeltsin, Leonard and Newman, Aaron M and Baumbach, Jan and Wittkop, Tobias and Su, Gang and Bader, Gary D and Ferrin, Thomas E",2011,BMC bioinformatics,BioMed Central,214,https://bmcbioinformatics.biomedcentral.com/articles/10.1186/1471-2105-12-436,clusterMaker
shannon2013rcytoscape,RCytoscape: tools for exploratory network analysis,"Shannon, Paul T and Grimes, Mark and Kutlu, Burak and Bot, Jan J and Galas, David J",2013,BMC bioinformatics,BioMed Central,69,https://bmcbioinformatics.biomedcentral.com/articles/10.1186/1471-2105-14-217,RCytoscape
garcia2010biana,Biana: a software framework for compiling biological interactions and analyzing networks,"Garcia-Garcia, Javier and Guney, Emre and Aragues, Ramon and Planas-Iglesias, Joan and Oliva, Baldo",2010,BMC bioinformatics,BioMed Central,63,https://bmcbioinformatics.biomedcentral.com/articles/10.1186/1471-2105-11-56,BIANA
luna2011formal,"A formal MIM specification and tools for the common exchange of MIM diagrams: an XML-Based format, an API, and a validation method","Luna, Augustin and Karac, Evrim I and Sunshine, Margot and Chang, Lucas and Nussinov, Ruth and Aladjem, Mirit I and Kohn, Kurt W",2011,BMC bioinformatics,BioMed Central,21,https://bmcbioinformatics.biomedcentral.com/articles/10.1186/1471-2105-12-167,MIM API
salazar2014web,A web-based protein interaction network visualizer,"Salazar, Gustavo A and Meintjes, Ayton and Mazandu, Gaston K and Rapano{\""e}l, Holifidy A and Akinola, Richard O and Mulder, Nicola J",2014,BMC bioinformatics,BioMed Central,19,https://bmcbioinformatics.biomedcentral.com/articles/10.1186/1471-2105-15-129,PINV
forman2005spectralnet,SpectralNET--an application for spectral graph analysis and visualization,"Forman, Joshua J and Clemons, Paul A and Schreiber, Stuart L and Haggarty, Stephen J",2005,BMC bioinformatics,BioMed Central,38,https://bmcbioinformatics.biomedcentral.com/articles/10.1186/1471-2105-6-260,SpectralNET
gonccalves2013cysbgn,CySBGN: a cytoscape plug-in to integrate SBGN maps,"Gon{\c{c}}alves, Emanuel and van Iersel, Martijn and Saez-Rodriguez, Julio",2013,BMC bioinformatics,BioMed Central,8,https://bmcbioinformatics.biomedcentral.com/articles/10.1186/1471-2105-14-17,CySBGN
dinkla2014examine,eXamine: Exploring annotated modules in networks,"Dinkla, Kasper and El-Kebir, Mohammed and Bucur, Cristina-Iulia and Siderius, Marco and Smit, Martine J and Westenberg, Michel A and Klau, Gunnar W",2014,BMC bioinformatics,BioMed Central,20,https://bmcbioinformatics.biomedcentral.com/articles/10.1186/1471-2105-15-201,eXamine
wang20133dscapecs,"3DScapeCS: application of three dimensional, parallel, dynamic network visualization in Cytoscape","Wang, Qi and Tang, Biao and Song, Lifu and Ren, Biao and Liang, Qun and Xie, Feng and Zhuo, Ying and Liu, Xueting and Zhang, Lixin",2013,BMC bioinformatics,BioMed Central,13,https://bmcbioinformatics.biomedcentral.com/articles/10.1186/1471-2105-14-322,3DScapeCS
bohler2015automatically,Automatically visualise and analyse data on pathways using PathVisioRPC from any programming environment,"Bohler, Anwesha and Eijssen, Lars MT and van Iersel, Martijn P and Leemans, Christ and Willighagen, Egon L and Kutmon, Martina and Jaillard, Magali and Evelo, Chris T",2015,BMC bioinformatics,BioMed Central,8,https://bmcbioinformatics.biomedcentral.com/articles/10.1186/s12859-015-0708-8,PathVisioRPC
moulos2013kupnetviz,The KUPNetViz: a biological network viewer for multiple-omics datasets in kidney diseases,"Moulos, Panagiotis and Klein, Julie and Jupp, Simon and Stevens, Robert and Bascands, Jean-Loup and Schanstra, Joost P",2013,BMC bioinformatics,BioMed Central,11,https://bmcbioinformatics.biomedcentral.com/articles/10.1186/1471-2105-14-235,KUPNetViz
toure2016ston,STON: exploring biological pathways using the SBGN standard and graph databases,"Tour{\'e}, Vasundra and Mazein, Alexander and Waltemath, Dagmar and Balaur, Irina and Saqi, Mansoor and Henkel, Ron and Pellet, Johann and Auffray, Charles",2016,BMC bioinformatics,BioMed Central,6,https://bmcbioinformatics.biomedcentral.com/articles/10.1186/s12859-016-1394-x,STON
zhu2015pathrings,PathRings: a web-based tool for exploration of ortholog and expression data in biological pathways,"Zhu, Yongnan and Sun, Liang and Garbarino, Alexander and Schmidt, Carl and Fang, Jinglong and Chen, Jian",2015,BMC bioinformatics,BioMed Central,12,https://bmcbioinformatics.biomedcentral.com/articles/10.1186/s12859-015-0585-1,PathRings
durand2006genolink,Genolink: a graph-based querying and browsing system for investigating the function of genes and proteins,"Durand, Patrick and Labarre, Laurent and Meil, Alain and Divol, Jean-Louis and Vandenbrouck, Yves and Viari, Alain and Wojcik, J{\'e}r{\^o}me",2006,BMC bioinformatics,BioMed Central,21,https://bmcbioinformatics.biomedcentral.com/articles/10.1186/1471-2105-7-21,GenoLink
seal2016netpredictor,Netpredictor: R and Shiny package to perform Drug-Target Bipartite network analysis and prediction of missing links.,"Seal, Abhik and Wild, David John",2016,bioRxiv,Cold Spring Harbor Laboratory,2,https://www.biorxiv.org/content/early/2016/10/10/080036.abstract,Netpredictor
ma2009snavi,SNAVI: Desktop application for analysis and visualization of large-scale signaling networks,"Ma'ayan, Avi and Jenkins, Sherry L and Webb, Ryan L and Berger, Seth I and Purushothaman, Sudarshan P and Abul-Husn, Noura S and Posner, Jeremy M and Flores, Tony and Iyengar, Ravi",2009,BMC systems biology,BioMed Central,35,https://bmcsystbiol.biomedcentral.com/articles/10.1186/1752-0509-3-10,SNAVI
czerwinska2015dedal,DeDaL: Cytoscape 3 app for producing and morphing data-driven and structure-driven network layouts,"Czerwinska, Urszula and Calzone, Laurence and Barillot, Emmanuel and Zinovyev, Andrei",2015,BMC systems biology,BioMed Central,12,https://bmcsystbiol.biomedcentral.com/articles/10.1186/s12918-015-0189-4,DeDaL
ruths2008rapidly,Rapidly exploring structural and dynamic properties of signaling networks using PathwayOracle,"Ruths, Derek and Nakhleh, Luay and Ram, Prahlad T",2008,BMC systems biology,BioMed Central,17,https://bmcsystbiol.biomedcentral.com/articles/10.1186/1752-0509-2-76,PathwayOracle
zhukova2015mimoza,Mimoza: web-based semantic zooming and navigation in metabolic networks,"Zhukova, Anna and Sherman, David J",2015,BMC systems biology,BioMed Central,1,https://bmcsystbiol.biomedcentral.com/articles/10.1186/s12918-015-0151-5,Mimoza
warsow2010expressence,ExprEssence-revealing the essence of differential experimental data in the context of an interaction/regulation net-work,"Warsow, Gregor and Greber, Boris and Falk, Steffi SI and Harder, Clemens and Siatkowski, Marcin and Schordan, Sandra and Som, Anup and Endlich, Nicole and Sch{\""o}ler, Hans and Repsilber, Dirk and others",2010,BMC systems biology,BioMed Central,79,https://bmcsystbiol.biomedcentral.com/articles/10.1186/1752-0509-4-164,ExprEssence
hart2015panda,PANDA: pathway and annotation explorer for visualizing and interpreting gene-centric data,"Hart, Steven N and Moore, Raymond M and Zimmermann, Michael T and Oliver, Gavin R and Egan, Jan B and Bryce, Alan H and Kocher, Jean-Pierre A",2015,PeerJ,PeerJ Inc.,3,https://peerj.com/articles/970,PANDA
dahlquist2016grnsight,GRNsight: a web application and service for visualizing models of small-to medium-scale gene regulatory networks,"Dahlquist, Kam D and Dionisio, John David N and Fitzpatrick, Ben G and Anguiano, Nicole A and Varshneya, Anindita and Southwick, Britain J and Samdarshi, Mihir",2016,PeerJ Computer Science,PeerJ Inc.,1,https://peerj.com/articles/cs-85/,GRNsight
landesfeind2014integrative,Integrative study of Arabidopsis thaliana metabolomic and transcriptomic data with the interactive MarVis-Graph software,"Landesfeind, Manuel and Kaever, Alexander and Feussner, Kirstin and Thurow, Corinna and Gatz, Christiane and Feussner, Ivo and Meinicke, Peter",2014,PeerJ,PeerJ Inc.,6,https://peerj.com/articles/239/,MarVis-Graph
li2005ubviz,UBViz: a software tool for exploring metabolic pathways in 3-D space,"Li, Song and Chou, Hui-Hsien",2005,BioTechniques,Future Science,2,https://www.future-science.com/doi/full/10.2144/05384BM04,UBViz
chang2016mango,Mango: combining and analyzing heterogeneous biological networks,"Chang, Jennifer and Cho, Hyejin and Chou, Hui-Hsien",2016,BioData mining,BioMed Central,4,https://biodatamining.biomedcentral.com/articles/10.1186/s13040-016-0105-5,Mango
kostromins2012paint4net,Paint4Net: COBRA Toolbox extension for visualization of stoichiometric models of metabolism,"Kostromins, Andrejs and Stalidzans, Egils",2012,Biosystems,Elsevier,36,https://www.sciencedirect.com/science/article/pii/S0303264712000524,Paint4Net
gogoshin2017new,New algorithm and software (BNOmics) for inferring and visualizing bayesian networks from heterogeneous big biological and genetic data,"Gogoshin, Grigoriy and Boerwinkle, Eric and Rodin, Andrei S",2017,Journal of Computational Biology,"Mary Ann Liebert, Inc. 140 Huguenot Street, 3rd Floor New Rochelle, NY 10801 USA",6,https://www.liebertpub.com/doi/abs/10.1089/cmb.2016.0100,BNOmics
xu2018pypathway,PyPathway: Python Package for Biological Network Analysis and Visualization,"Xu, Yang and Luo, Xiao-Chun",2018,Journal of Computational Biology,"Mary Ann Liebert, Inc. 140 Huguenot Street, 3rd Floor New Rochelle, NY 10801 USA",0,https://www.liebertpub.com/doi/abs/10.1089/cmb.2017.0199,PyPathway
costa2016cylineup,CyLineUp: A cytoscape app for visualizing data in network small multiples,"Costa, Maria Cec{\'\i}lia D and Slijkhuis, Thijs and Ligterink, Wilco and Hilhorst, Henk WM and de Ridder, Dick and Nijveen, Harm",2016,F1000Research,Faculty of 1000 Ltd,2,https://www.ncbi.nlm.nih.gov/pmc/articles/PMC4909101.1/,CyLineUp
kao2008browsing,Browsing Multidimensional Molecular Networks with the Generic Network Browser (N-Browse),"Kao, Huey-Ling and Gunsalus, Kristin C",2008,Current protocols in bioinformatics,Wiley Online Library,34,https://currentprotocols.onlinelibrary.wiley.com/doi/abs/10.1002/0471250953.bi0911s23,N-Browse
nishida2014keggscape,KEGGscape: a Cytoscape app for pathway data integration,"Nishida, Kozo and Ono, Keiichiro and Kanaya, Shigehiko and Takahashi, Koichi",2014,F1000Research,Faculty of 1000 Ltd,27,https://www.ncbi.nlm.nih.gov/pmc/articles/PMC4141640/,KEGGscape
morris2014enhancedgraphics,enhancedGraphics: a Cytoscape app for enhanced node graphics,"Morris, John H and Kuchinsky, Allan and Ferrin, Thomas E and Pico, Alexander R",2014,F1000Research,Faculty of 1000 Ltd,14,https://www.ncbi.nlm.nih.gov/pmc/articles/PMC4176421/,enhancedGraphics
dilek2010visibioweb,VISIBIOweb: visualization and layout services for BioPAX pathway models,"Dilek, Alptug and Belviranli, Mehmet E and Dogrusoz, Ugur",2010,Nucleic acids research,Oxford University Press,14,https://academic.oup.com/nar/article-abstract/38/suppl_2/W150/1102602,VISIBIOweb
jia2010metnetge,MetNetGE: interactive views of biological networks and ontologies,"Jia, Ming and Choi, Suh-Yeon and Reiners, Dirk and Wurtele, Eve S and Dickerson, Julie A",2010,BMC bioinformatics,BioMed Central,11,https://bmcbioinformatics.biomedcentral.com/articles/10.1186/1471-2105-11-469,MetNetGE
jia2009metnetge,MetNetGE: Visualizing biological networks in hierarchical views and 3D tiered layouts,"Jia, Ming and Swaminathan, Sivakumar and Wurtele, Eve Syrkin and Dickerson, Julie",2009,,,6,https://ieeexplore.ieee.org/abstract/document/5332109/,MetNetGE
iragne2004proviz,ProViz: protein interaction visualization and exploration,"Iragne, Florian and Nikolski, Macha and Mathieu, Bertrand and Auber, David and Sherman, David",2004,Bioinformatics,Oxford University Press,128,https://academic.oup.com/bioinformatics/article-abstract/21/2/272/187257,ProViz
berger2007avis,AVIS: AJAX viewer of interactive signaling networks,"Berger, Seth I and Iyengar, Ravi and Ma’ayan, Avi",2007,Bioinformatics,Oxford University Press,34,https://academic.oup.com/bioinformatics/article-abstract/23/20/2803/231311,AVIS
huttenhower2009graphle,"Graphle: Interactive exploration of large, dense graphs","Huttenhower, Curtis and Mehmood, Sajid O and Troyanskaya, Olga G",2009,BMC bioinformatics,BioMed Central,19,https://bmcbioinformatics.biomedcentral.com/articles/10.1186/1471-2105-10-417,Graphle
khomtchouk2016microscope,MicroScope: ChIP-seq and RNA-seq software analysis suite for gene expression heatmaps,"Khomtchouk, Bohdan B and Hennessy, James R and Wahlestedt, Claes",2016,BMC bioinformatics,BioMed Central,7,https://bmcbioinformatics.biomedcentral.com/articles/10.1186/s12859-016-1260-x,MicroScope
singhal2007cabin,CABIN: collective analysis of biological interaction networks,"Singhal, Mudita and Domico, Kelly",2007,Computational Biology and Chemistry,Elsevier,24,https://www.sciencedirect.com/science/article/pii/S1476927107000552,Collective Analysis of Biological Interaction Networks
negishi2007expanda,eXpanda: an integrated platform for network analysis and visualization,"Negishi, Yoshiteru and Nakamura, Hiroyuki and Yachie, Nozomu and Saito, Rintaro and Tomita, Masaru",2007,In silico biology,IOS Press,6,https://content.iospress.com/articles/in-silico-biology/isb00283,eXpanda
hu2014vnp,"VNP: interactive visual network pharmacology of diseases, targets, and drugs","Hu, Q-N and Deng, Z and Tu, W and Yang, X and Meng, Z-B and Deng, Z-X and Liu, J",2014,CPT: pharmacometrics \& systems pharmacology,Wiley Online Library,13,https://ascpt.onlinelibrary.wiley.com/doi/abs/10.1038/psp.2014.1,VNP
ahmed2005geomi,Geomi: Geometry for maximum insight,"Ahmed, Adel and Dwyer, Tim and Forster, Michael and Fu, Xiaoyan and Ho, Joshua and Hong, Seok-Hee and Kosch{\""u}tzki, Dirk and Murray, Colin and Nikolov, Nikola S and Taib, Ronnie and others",2005,,,61,https://link.springer.com/chapter/10.1007/11618058_42,GEOMI
