key,title,authors,year,journal,publisher,citations,url,tool
bernier2014ribovision,RiboVision suite for visualization and analysis of ribosomes,"Bernier, Chad R and Petrov, Anton S and Waterbury, Chris C and Jett, James and Li, Fengbo and Freil, Larry E and Xiong, Xiao and Wang, Lan and Migliozzi, Blacki LR and Hershkovits, Eli and others",2014,Faraday discussions,Royal Society of Chemistry,33,http://pubs.rsc.org/en/content/articlehtml/2014/fd/c3fd00126a,RiboVision
han2007pri,PRI-modeler: extracting RNA structural elements from PDB files of protein--RNA complexes,"Han, Kyungsook and Nepal, Chirag",2007,FEBS letters,Elsevier,16,https://www.sciencedirect.com/science/article/pii/S0014579307003638,PRI-Modeler
elias2017traveler,TRAVeLer: a tool for template-based RNA secondary structure visualization,"Elias, Richard and Hoksza, David",2017,BMC bioinformatics,BioMed Central,1,https://bmcbioinformatics.biomedcentral.com/articles/10.1186/s12859-017-1885-4,TRAVeLer
shi2017jnsviewer,JNSViewer—A JavaScript-based nucleotide sequence viewer for DNA/RNA secondary structures,"Shi, Jieming and Li, Xi and Dong, Min and Graham, Mitchell and Yadav, Nehul and Liang, Chun",2017,PloS one,Public Library of Science,1,http://journals.plos.org/plosone/article?id=10.1371/journal.pone.0179040,JNSViewer
liu2016reprna,repRNA: a web server for generating various feature vectors of RNA sequences,"Liu, Bin and Liu, Fule and Fang, Longyun and Wang, Xiaolong and Chou, Kuo-Chen",2016,Molecular Genetics and Genomics,Springer,108,https://link.springer.com/article/10.1007/s00438-015-1078-7,repRNA
weinberg2011r2r,R2R-software to speed the depiction of aesthetic consensus RNA secondary structures,"Weinberg, Zasha and Breaker, Ronald R",2011,BMC bioinformatics,BioMed Central,103,https://bmcbioinformatics.biomedcentral.com/articles/10.1186/1471-2105-12-3,R2R
pietal2012rnamap2d,"RNAmap2D--calculation, visualization and analysis of contact and distance maps for RNA and protein-RNA complex structures","Pietal, Michal J and Szostak, Natalia and Rother, Kristian M and Bujnicki, Janusz M",2012,BMC bioinformatics,BioMed Central,11,https://bmcbioinformatics.biomedcentral.com/articles/10.1186/1471-2105-13-333,RNAmap2D
engelen2007predicting,Predicting RNA secondary structure by the comparative approach: how to select the homologous sequences,"Engelen, Stefan and Tahi, Fariza",2007,BMC bioinformatics,BioMed Central,21,https://bmcbioinformatics.biomedcentral.com/articles/10.1186/1471-2105-8-464,SSCA
xu2011rna2dmap,RNA2DMap: A Visual Exploration Tool of the Information in RNA's Higher-Order Structure,"Xu, Weijia and Wongsa, Ame and Lee, Jung and Shang, Lei and Cannone, Jamie J and Gutell, Robin R",2011,,,4,https://ieeexplore.ieee.org/abstract/document/6120513/,RNA2DMap
tsang2012rna,RNA-DV: An interactive tool for editing and visualizing RNA secondary structures,"Tsang, Herbert H and Dai, Denny C",2012,,,3,https://dl.acm.org/citation.cfm?id=2383036,RNA-DV
zhang2002rnastudio,"RNAStudio, a full-featured object-oriented program for visualizing RNA secondary structures","Zhang, Hao and Liu, Ci-Quan",2002,Journal of Molecular Graphics and Modelling,Elsevier,9,https://www.sciencedirect.com/science/article/pii/S1093326301001413,RNAStudio
haberle2015cager,CAGEr: precise TSS data retrieval and high-resolution promoterome mining for integrative analyses,"Haberle, Vanja and Forrest, Alistair RR and Hayashizaki, Yoshihide and Carninci, Piero and Lenhard, Boris",2015,Nucleic acids research,Oxford University Press,34,https://academic.oup.com/nar/article-abstract/43/8/e51/2414172,CAGEr
dimont2014cagexplorer,CAGExploreR: an R package for the analysis and visualization of promoter dynamics across multiple experiments,"Dimont, Emmanuel and Hofmann, Oliver and Ho Sui, Shannan J and Forrest, Alistair RR and Kawaji, Hideya and Consortium, FANTOM and Hide, Winston",2014,Bioinformatics,Oxford University Press,2,https://academic.oup.com/bioinformatics/article-abstract/30/8/1183/2748133,CAGExploreR
villiers2014rs,"RS WebTool, a web server for random sampling-based significance evaluation of pairwise distances","Villiers, Florent and Bastien, Olivier and Kwak, June M",2014,Nucleic acids research,Oxford University Press,0,https://academic.oup.com/nar/article-abstract/42/W1/W198/2437425,R. S. WebTool
gautier2004affy,affy—analysis of Affymetrix GeneChip data at the probe level,"Gautier, Laurent and Cope, Leslie and Bolstad, Benjamin M and Irizarry, Rafael A",2004,Bioinformatics,Oxford University Press,3036,https://academic.oup.com/bioinformatics/article-abstract/20/3/307/185980,affy
bolstad2003comparison,A comparison of normalization methods for high density oligonucleotide array data based on variance and bias,"Bolstad, Benjamin M and Irizarry, Rafael A and {\AA}strand, Magnus and Speed, Terence P.",2003,Bioinformatics,Oxford University Press,7463,https://academic.oup.com/bioinformatics/article-abstract/19/2/185/372664,affy
battke2011mayday,Mayday SeaSight: combined analysis of deep sequencing and microarray data,"Battke, Florian and Nieselt, Kay",2011,PLoS One,Public Library of Science,19,http://journals.plos.org/plosone/article?id=10.1371/journal.pone.0016345,Mayday
battke2010mayday,Mayday-integrative analytics for expression data,"Battke, Florian and Symons, Stephan and Nieselt, Kay",2010,BMC bioinformatics,BioMed Central,107,https://bmcbioinformatics.biomedcentral.com/articles/10.1186/1471-2105-11-121,Mayday
dietzsch2006mayday,Mayday-a microarray data analysis workbench,"Dietzsch, Janko and Gehlenborg, Nils and Nieselt, Kay",2006,Bioinformatics,Oxford University Press,68,https://academic.oup.com/bioinformatics/article-abstract/22/8/1010/227568,Mayday
eijssen2015user,A user-friendly workflow for analysis of Illumina gene expression bead array data available at the arrayanalysis. org portal,"Eijssen, Lars MT and Goelela, Varshna S and Kelder, Thomas and Adriaens, Michiel E and Evelo, Chris T and Radonjic, Marijana",2015,BMC genomics,BioMed Central,4,https://bmcgenomics.biomedcentral.com/articles/10.1186/s12864-015-1689-8,ArrayAnalysis.org
eijssen2013user,User-friendly solutions for microarray quality control and pre-processing on ArrayAnalysis. org,"Eijssen, Lars MT and Jaillard, Magali and Adriaens, Michiel E and Gaj, Stan and de Groot, Philip J and M{\""u}ller, Michael and Evelo, Chris T",2013,Nucleic acids research,Oxford University Press,87,https://academic.oup.com/nar/article-abstract/41/W1/W71/1093291,ArrayAnalysis.org
rainer2006carmaweb,CARMAweb: comprehensive R-and bioconductor-based web service for microarray data analysis,"Rainer, Johannes and Sanchez-Cabo, Fatima and Stocker, Gernot and Sturn, Alexander and Trajanoski, Zlatko",2006,Nucleic acids research,Oxford University Press,226,https://academic.oup.com/nar/article-abstract/34/suppl_2/W498/2505475,CARMAweb
xu2010arraytrack,ArrayTrack: a free FDA bioinformatics tool to support emerging biomedical research--an update,"Xu, Joshua and Kelly, Reagan and Fang, Hong and Tong, Weida",2010,Human genomics,BioMed Central,13,https://humgenomics.biomedcentral.com/articles/10.1186/1479-7364-4-6-428,ArrayTrack
fang2009arraytrack,ArrayTrack: an FDA and public genomic tool,"Fang, Hong and Harris, Stephen C and Su, Zhenjiang and Chen, Minjun and Qian, Feng and Shi, Leming and Perkins, Roger and Tong, Weida",2009,,Springer,62,https://link.springer.com/protocol/10.1007/978-1-60761-175-2_20,ArrayTrack
carvalho2010framework,A framework for oligonucleotide microarray preprocessing,"Carvalho, Benilton S and Irizarry, Rafael A",2010,Bioinformatics,Oxford University Press,517,https://academic.oup.com/bioinformatics/article-abstract/26/19/2363/228760,Oligo package
pavlidis2003matrix2png,Matrix2png: a utility for visualizing matrix data,"Pavlidis, Paul and Noble, William Stafford",2003,Bioinformatics,Oxford University Press,312,https://academic.oup.com/bioinformatics/article-abstract/19/2/295/372766,Matrix2png
pan2006integrative,Integrative Array Analyzer: a software package for analysis of cross-platform and cross-species microarray data,"Pan, Fei and Kamath, Kiran and Zhang, Kangyu and Pulapura, Sudip and Achar, Avinash and Nunez-Iglesias, Juan and Huang, Yu and Yan, Xifeng and Han, Jiawei and Hu, Haiyan and others",2006,Bioinformatics,Oxford University Press,23,https://academic.oup.com/bioinformatics/article-abstract/22/13/1665/194273,iArray
gribov2010seurat,SEURAT: visual analytics for the integrated analysis of microarray data,"Gribov, Alexander and Sill, Martin and L{\""u}ck, Sonja and R{\""u}cker, Frank and D{\""o}hner, Konstanze and Bullinger, Lars and Benner, Axel and Unwin, Antony",2010,BMC medical genomics,BioMed Central,20,https://bmcmedgenomics.biomedcentral.com/articles/10.1186/1755-8794-3-21,SEURAT
galardini2014ductape,DuctApe: a suite for the analysis and correlation of genomic and OmniLog™ phenotype microarray data,"Galardini, Marco and Mengoni, Alessio and Biondi, Emanuele G and Semeraro, Roberto and Florio, Alessandro and Bazzicalupo, Marco and Benedetti, Anna and Mocali, Stefano",2014,Genomics,Elsevier,37,https://www.sciencedirect.com/science/article/pii/S0888754313002085,DuctApe
roden2014zodet,"ZODET: software for the identification, analysis and visualisation of outlier genes in microarray expression data","Roden, Daniel L and Sewell, Gavin W and Lobley, Anna and Levine, Adam P and Smith, Andrew M and Segal, Anthony W",2014,PloS one,Public Library of Science,5,http://journals.plos.org/plosone/article?id=10.1371/journal.pone.0081123,ZODET
hughes2017expressiondb,ExpressionDB: An open source platform for distributing genome-scale datasets,"Hughes, Laura D and Lewis, Scott A and Hughes, Michael E",2017,PloS one,Public Library of Science,2,http://journals.plos.org/plosone/article?id=10.1371/journal.pone.0187457,ExpressionDB
rees2004genexplorer,GeneXplorer: an interactive web application for microarray data visualization and analysis,"Rees, Christian A and Demeter, Janos and Matese, John C and Botstein, David and Sherlock, Gavin",2004,BMC bioinformatics,BioMed Central,27,https://bmcbioinformatics.biomedcentral.com/articles/10.1186/1471-2105-5-141,GeneXplorer
milone2010omesom,* omeSOM: a software for clustering and visualization of transcriptional and metabolite data mined from interspecific crosses of crop plants,"Milone, Diego H and Stegmayer, Georgina S and Kamenetzky, Laura and L{\'o}pez, Mariana and Lee, Je Min and Giovannoni, James J and Carrari, Fernando",2010,BMC bioinformatics,BioMed Central,27,https://bmcbioinformatics.biomedcentral.com/articles/10.1186/1471-2105-11-438,omeSOM
ruzanov2006interactive,An interactive tool for visualization of relationships between gene expression profiles,"Ruzanov, Peter and Jones, Steven JM",2006,BMC bioinformatics,BioMed Central,1,https://bmcbioinformatics.biomedcentral.com/articles/10.1186/1471-2105-7-193,TreeBuilder3D
kumar2007mfuzz,Mfuzz: a software package for soft clustering of microarray data,"Kumar, Lokesh and Futschik, Matthias E",2007,Bioinformation,Biomedical Informatics Publishing Group,189,https://www.ncbi.nlm.nih.gov/pmc/articles/PMC2139991/,Mfuzz
yates2007x,X: Map: annotation and visualization of genome structure for Affymetrix exon array analysis,"Yates, Tim and Okoniewski, Micha{\l} J and Miller, Crispin J",2007,Nucleic Acids Research,Oxford University Press,76,https://academic.oup.com/nar/article-abstract/36/suppl_1/D780/2506194,Annmap
okoniewski2007annotation,An annotation infrastructure for the analysis and interpretation of Affymetrix exon array data,"Okoniewski, Micha{\l} J and Yates, Tim and Dibben, Si{\^a}n and Miller, Crispin J",2007,Genome biology,BioMed Central,55,https://genomebiology.biomedcentral.com/articles/10.1186/gb-2007-8-5-r79,Annmap
awad2004caryoscope,Caryoscope: an Open Source Java application for viewing microarray data in a genomic context,"Awad, Ihab AB and Rees, Christian A and Hernandez-Boussard, Tina and Ball, Catherine A and Sherlock, Gavin",2004,BMC bioinformatics,BioMed Central,35,https://bmcbioinformatics.biomedcentral.com/articles/10.1186/1471-2105-5-151,Caryoscope
lelandais2004micovito,MiCoViTo: a tool for gene-centric comparison and visualization of yeast transcriptome states,"Lelandais, Ga{\""e}lle and Marc, Philippe and Vincens, Pierre and Jacq, Claude and Vialette, St{\'e}phane",2004,BMC bioinformatics,BioMed Central,5,https://bmcbioinformatics.biomedcentral.com/articles/10.1186/1471-2105-5-20,MiCoViTo
setty2016wishbone,Wishbone identifies bifurcating developmental trajectories from single-cell data,"Setty, Manu and Tadmor, Michelle D and Reich-Zeliger, Shlomit and Angel, Omer and Salame, Tomer Meir and Kathail, Pooja and Choi, Kristy and Bendall, Sean and Friedman, Nir and Pe'er, Dana",2016,Nature biotechnology,Nature Publishing Group,181,https://www.nature.com/nbt/journal/v34/n6/abs/nbt.3569.html,Wishbone
qiu2011extracting,Extracting a cellular hierarchy from high-dimensional cytometry data with SPADE,"Qiu, Peng and Simonds, Erin F and Bendall, Sean C and Gibbs Jr, Kenneth D and Bruggner, Robert V and Linderman, Michael D and Sachs, Karen and Nolan, Garry P and Plevritis, Sylvia K",2011,Nature biotechnology,Nature Publishing Group,492,https://www.nature.com/nbt/journal/v29/n10/abs/nbt.1991.html,SPADE
bendall2011single,Single-cell mass cytometry of differential immune and drug responses across a human hematopoietic continuum,"Bendall, Sean C and Simonds, Erin F and Qiu, Peng and El-ad, D Amir and Krutzik, Peter O and Finck, Rachel and Bruggner, Robert V and Melamed, Rachel and Trejo, Angelica and Ornatsky, Olga I and others",2011,Science,American Association for the Advancement of Science,1237,http://science.sciencemag.org/content/332/6030/687.short,SPADE
qiu2017single,Single-cell mRNA quantification and differential analysis with Census,"Qiu, Xiaojie and Hill, Andrew and Packer, Jonathan and Lin, Dejun and Ma, Yi-An and Trapnell, Cole",2017,Nature methods,Nature Publishing Group,77,https://www.nature.com/nmeth/journal/v14/n3/abs/nmeth.4150.html,Monocle
qiu2017reversed,Reversed graph embedding resolves complex single-cell trajectories,"Qiu, Xiaojie and Mao, Qi and Tang, Ying and Wang, Li and Chawla, Raghav and Pliner, Hannah A and Trapnell, Cole",2017,Nature methods,Nature Publishing Group,91,https://www.nature.com/nmeth/journal/v14/n10/abs/nmeth.4402.html,Monocle
trapnell2014dynamics,The dynamics and regulators of cell fate decisions are revealed by pseudotemporal ordering of single cells,"Trapnell, Cole and Cacchiarelli, Davide and Grimsby, Jonna and Pokharel, Prapti and Li, Shuqiang and Morse, Michael and Lennon, Niall J and Livak, Kenneth J and Mikkelsen, Tarjei S and Rinn, John L",2014,Nature biotechnology,Nature Publishing Group,615,https://www.nature.com/nbt/journal/v32/n4/abs/nbt.2859.html,Monocle
karaiskos2017drosophila,The Drosophila embryo at single-cell transcriptome resolution,"Karaiskos, Nikos and Wahle, Philipp and Alles, Jonathan and Boltengagen, Anastasiya and Ayoub, Salah and Kipar, Claudia and Kocks, Christine and Rajewsky, Nikolaus and Zinzen, Robert P",2017,Science,American Association for the Advancement of Science,31,http://science.sciencemag.org/content/358/6360/194.abstract,DistMap
fan2016characterizing,Characterizing transcriptional heterogeneity through pathway and gene set overdispersion analysis,"Fan, Jean and Salathia, Neeraj and Liu, Rui and Kaeser, Gwendolyn E and Yung, Yun C and Herman, Joseph L and Kaper, Fiona and Fan, Jian-Bing and Zhang, Kun and Chun, Jerold and others",2016,Nature methods,Nature Publishing Group,103,https://www.nature.com/nmeth/journal/v13/n3/abs/nmeth.3734.html,SCDE
kharchenko2014bayesian,Bayesian approach to single-cell differential expression analysis,"Kharchenko, Peter V and Silberstein, Lev and Scadden, David T",2014,Nature methods,Nature Publishing Group,344,https://www.nature.com/nmeth/journal/v11/n7/abs/nmeth.2967.html,SCDE
davie2018single,A single-cell transcriptome atlas of the aging Drosophila brain,"Davie, Kristofer and Janssens, Jasper and Koldere, Duygu and De Waegeneer, Maxime and Pech, Uli and Kreft, {\L}ukasz and Aibar, Sara and Makhzami, Samira and Christiaens, Valerie and Gonz{\'a}lez-Blas, Carmen Bravo and others",2018,Cell,Elsevier,11,https://www.cell.com/cell/abstract/S0092-8674(18)30720-7,SCope
stubbington2016t,T cell fate and clonality inference from single-cell transcriptomes,"Stubbington, Michael JT and L{\""o}nnberg, Tapio and Proserpio, Valentina and Clare, Simon and Speak, Anneliese O and Dougan, Gordon and Teichmann, Sarah A",2016,Nature methods,Nature Publishing Group,102,https://www.nature.com/nmeth/journal/v13/n4/abs/nmeth.3800.html,TraCeR
gardeux2017asap,ASAP: a web-based platform for the analysis and interactive visualization of single-cell RNA-seq data,"Gardeux, Vincent and David, Fabrice PA and Shajkofci, Adrian and Schwalie, Petra C and Deplancke, Bart",2017,Bioinformatics,Oxford University Press,13,https://academic.oup.com/bioinformatics/article-abstract/33/19/3123/3852081,ASAP
zhu2018granatumx,GranatumX: A community engaging and flexible software environment for single-cell analysis,"Zhu, Xun and Yunits, Breck and Wolfgruber, Thomas and Poirion, Olivier and Arisdakessian, Cedric and Garmire, Lana",2018,bioRxiv,Cold Spring Harbor Laboratory,0,https://www.biorxiv.org/content/early/2018/08/06/385591.abstract,Granatum
zhu2017granatum,Granatum: a graphical single-cell RNA-Seq analysis pipeline for genomics scientists,"Zhu, Xun and Wolfgruber, Thomas K and Tasato, Austin and Arisdakessian, C{\'e}dric and Garmire, David G and Garmire, Lana X",2017,Genome medicine,BioMed Central,13,https://genomemedicine.biomedcentral.com/articles/10.1186/s13073-017-0492-3,Granatum
wolf2018scanpy,SCANPY: large-scale single-cell gene expression data analysis,"Wolf, F Alexander and Angerer, Philipp and Theis, Fabian J",2018,Genome biology,BioMed Central,18,https://genomebiology.biomedcentral.com/articles/10.1186/s13059-017-1382-0,Scanpy
ho2018single,Single-cell RNA-seq analysis identifies markers of resistance to targeted BRAF inhibitors in melanoma cell populations,"Ho, Yu-Jui and Anaparthy, Naishitha and Molik, David and Mathew, Grinu and Aicher, Toby and Patel, Ami and Hicks, James and Hammell, Molly Gale",2018,Genome research,Cold Spring Harbor Lab,0,http://genome.cshlp.org/content/early/2018/07/30/gr.234062.117.abstract,Sake
zappia2017splatter,Splatter: simulation of single-cell RNA sequencing data,"Zappia, Luke and Phipson, Belinda and Oshlack, Alicia",2017,Genome biology,BioMed Central,23,https://genomebiology.biomedcentral.com/articles/10.1186/s13059-017-1305-0,Splatter
iacono2018bigscale,bigSCale: an analytical framework for big-scale single-cell data,"Iacono, Giovanni and Mereu, Elisabetta and Guillaumet-Adkins, Amy and Corominas, Roser and Cusc{\'o}, Ivon and Rodr{\'\i}guez-Esteban, Gustavo and Gut, Marta and P{\'e}rez-Jurado, Luis Alberto and Gut, Ivo and Heyn, Holger",2018,Genome research,Cold Spring Harbor Lab,1,http://genome.cshlp.org/content/early/2018/05/03/gr.230771.117.abstract,bigSCale
welch2017matcher,MATCHER: manifold alignment reveals correspondence between single cell transcriptome and epigenome dynamics,"Welch, Joshua D and Hartemink, Alexander J and Prins, Jan F",2017,Genome biology,BioMed Central,10,https://genomebiology.biomedcentral.com/articles/10.1186/s13059-017-1269-0,MATCHER
ji2016tscan,TSCAN: Pseudo-time reconstruction and evaluation in single-cell RNA-seq analysis,"Ji, Zhicheng and Ji, Hongkai",2016,Nucleic acids research,Oxford University Press,81,https://academic.oup.com/nar/article-abstract/44/13/e117/2457590,TSCAN
giecold2016robust,Robust lineage reconstruction from high-dimensional single-cell data,"Giecold, Gregory and Marco, Eugenio and Garcia, Sara P and Trippa, Lorenzo and Yuan, Guo-Cheng",2016,Nucleic acids research,Oxford University Press,16,https://academic.oup.com/nar/article-abstract/44/14/e122/2468175,Eclair
sinha2018dropclust,dropClust: efficient clustering of ultra-large scRNA-seq data,"Sinha, Debajyoti and Kumar, Akhilesh and Kumar, Himanshu and Bandyopadhyay, Sanghamitra and Sengupta, Debarka",2018,Nucleic acids research,Oxford University Press,5,https://academic.oup.com/nar/article-abstract/46/6/e36/4816215,dropClust
vieth2017powsimr,powsimR: power analysis for bulk and single cell RNA-seq experiments,"Vieth, Beate and Ziegenhain, Christoph and Parekh, Swati and Enard, Wolfgang and Hellmann, Ines",2017,Bioinformatics,Oxford University Press,13,https://academic.oup.com/bioinformatics/article-abstract/33/21/3486/3952669,powsimR
angerer2015destiny,destiny: diffusion maps for large-scale single-cell data in R,"Angerer, Philipp and Haghverdi, Laleh and B{\""u}ttner, Maren and Theis, Fabian J and Marr, Carsten and Buettner, Florian",2015,Bioinformatics,Oxford University Press,75,https://academic.oup.com/bioinformatics/article-abstract/32/8/1241/1744143,destiny
reid2016pseudotime,Pseudotime estimation: deconfounding single cell time series,"Reid, John E and Wernisch, Lorenz",2016,Bioinformatics,Oxford University Press,45,https://academic.oup.com/bioinformatics/article-abstract/32/19/2973/2196633,DeLorean
julia2015sincell,Sincell: an R/Bioconductor package for statistical assessment of cell-state hierarchies from single-cell RNA-seq,"Juli{\'a}, Miguel and Telenti, Amalio and Rausell, Antonio",2015,Bioinformatics,Oxford University Press,29,https://academic.oup.com/bioinformatics/article-abstract/31/20/3380/195882,Sincell
weinreb2017spring,SPRING: a kinetic interface for visualizing high dimensional single-cell expression data,"Weinreb, Caleb and Wolock, Samuel and Klein, Allon M",2017,Bioinformatics,Oxford University Press,14,https://academic.oup.com/bioinformatics/article-abstract/34/7/1246/4708233,SPRING
diaz2016scell,SCell: integrated analysis of single-cell RNA-seq data,"Diaz, Aaron and Liu, Siyuan J and Sandoval, Carmen and Pollen, Alex and Nowakowski, Tom J and Lim, Daniel A and Kriegstein, Arnold",2016,Bioinformatics,Oxford University Press,20,https://academic.oup.com/bioinformatics/article-abstract/32/14/2219/1743130,SCell
guo2017hopland,HopLand: single-cell pseudotime recovery using continuous Hopfield network-based modeling of Waddington’s epigenetic landscape,"Guo, Jing and Zheng, Jie",2017,Bioinformatics,Oxford University Press,4,https://academic.oup.com/bioinformatics/article-abstract/33/14/i102/3953947,HopLand
mukherjee2018scalable,Scalable preprocessing for sparse scRNA-seq data exploiting prior knowledge,"Mukherjee, Sumit and Zhang, Yue and Fan, Joshua and Seelig, Georg and Kannan, Sreeram",2018,Bioinformatics,Oxford University Press,0,https://academic.oup.com/bioinformatics/article-abstract/34/13/i124/5045758,UNCURL
dey2017visualizing,Visualizing the structure of RNA-seq expression data using grade of membership models,"Dey, Kushal K and Hsiao, Chiaowen Joyce and Stephens, Matthew",2017,PLoS genetics,Public Library of Science,14,http://journals.plos.org/plosgenetics/article?id=10.1371/journal.pgen.1006599,CountClust
hollt2018cyteguide,Cyteguide: Visual guidance for hierarchical single-cell analysis,"H{\""o}llt, Thomas and Pezzotti, Nicola and van Unen, Vincent and Koning, Frits and Lelieveldt, Boudewijn PF and Vilanova, Anna",2018,IEEE transactions on visualization and computer graphics,IEEE,2,https://ieeexplore.ieee.org/iel7/2945/4359476/08017575.pdf,CyteGuide
yotsukura2016celltree,CellTree: an R/bioconductor package to infer the hierarchical structure of cell populations from single-cell RNA-seq data,"Yotsukura, Sohiya and Nomura, Seitaro and Aburatani, Hiroyuki and Tsuda, Koji and others",2016,BMC bioinformatics,BioMed Central,17,https://bmcbioinformatics.biomedcentral.com/articles/10.1186/s12859-016-1175-6,cellTree
lim2016btr,BTR: training asynchronous Boolean models using single-cell expression data,"Lim, Chee Yee and Wang, Huange and Woodhouse, Steven and Piterman, Nir and Wernisch, Lorenz and Fisher, Jasmin and G{\""o}ttgens, Berthold",2016,BMC bioinformatics,BioMed Central,14,https://bmcbioinformatics.biomedcentral.com/articles/10.1186/s12859-016-1235-y,BTR
andrews2016modelling,Modelling dropouts allows for unbiased identification of marker genes in scRNASeq experiments,"Andrews, Tallulah S and Hemberg, Martin",2016,biorxiv,Cold Spring Harbor Laboratory,5,https://www.biorxiv.org/content/early/2016/10/20/065094.abstract,M3Drop
zhang2019scedar,Scedar: a scalable Python package for single-cell RNA-seq exploratory data analysis,"Zhang, Yuanchao and Taylor, Deanne M",2019,bioRxiv,Cold Spring Harbor Laboratory,0,https://www.biorxiv.org/content/early/2018/07/24/375196.abstract,Scedar
la2018rna,RNA velocity of single cells,"La Manno, Gioele and Soldatov, Ruslan and Zeisel, Amit and Braun, Emelie and Hochgerner, Hannah and Petukhov, Viktor and Lidschreiber, Katja and Kastriti, Maria E and L{\""o}nnerberg, Peter and Furlan, Alessandro and others",2018,Nature,Nature Publishing Group,10,https://www.biorxiv.org/content/early/2017/10/19/206052.abstract,velocyto
lopez2018bayesian,Bayesian inference for a generative model of transcriptome profiles from single-cell RNA sequencing,"Lopez, Romain and Regier, Jeffrey and Cole, Michael B and Jordan, Michael and Yosef, Nir",2018,bioRxiv,Cold Spring Harbor Laboratory,0,https://www.biorxiv.org/content/early/2018/03/30/292037.abstract,scVI
rue2018isee,iSEE: Interactive SummarizedExperiment Explorer,"Rue-Albrecht, Kevin and Marini, Federico and Soneson, Charlotte and Lun, Aaron TL",2018,F1000Research,Faculty of 1000 Ltd,1,https://f1000research.com/articles/7-741,iSEE
kobak2018art,The art of using t-SNE for single-cell transcriptomics,"Kobak, Dmitry and Berens, Philipp",2018,bioRxiv,Cold Spring Harbor Laboratory,0,https://www.biorxiv.org/content/early/2018/10/25/453449.abstract,RNA-Seq-tSNE
